{"artifacts":[{"artifact_name":"amiss-linux-aarch64","binary_sha256":"sha256:31a74a1acd539fea4ca9ca26656aebf46e32f043bb6e06c2e7e29f908dbd0ee9","engine_digest":"sha256:24812b2512a7cb1b0eff965f345d57e16bd16ea855bc72fa536183fd9b4c2c60","environment_contract":"scanner-process-env","platform":"linux-aarch64","runtime_contract":"manifest-closed","runtime_files":[{"file_sha256":"sha256:642f9cfea065dc2a5d2651deb1812ff02108fdcb0088ee1d04f501418e85a711","git_mode":"100644","path":"action.yml","role":"runtime-data"},{"file_sha256":"sha256:31a74a1acd539fea4ca9ca26656aebf46e32f043bb6e06c2e7e29f908dbd0ee9","git_mode":"100755","path":"dist/amiss-linux-aarch64","role":"executable"}],"tree_path":"dist/amiss-linux-aarch64"},{"artifact_name":"amiss-linux-x86_64","binary_sha256":"sha256:53b4ca6255c94e8aea32604e5ad58e919bf143e4800be14fb7142cd54f874523","engine_digest":"sha256:fb691b97e05fa87c617a70a0a9b51a6ef523df5ca00b46d3b63717bbc75f13e8","environment_contract":"scanner-process-env","platform":"linux-x86_64","runtime_contract":"manifest-closed","runtime_files":[{"file_sha256":"sha256:642f9cfea065dc2a5d2651deb1812ff02108fdcb0088ee1d04f501418e85a711","git_mode":"100644","path":"action.yml","role":"runtime-data"},{"file_sha256":"sha256:53b4ca6255c94e8aea32604e5ad58e919bf143e4800be14fb7142cd54f874523","git_mode":"100755","path":"dist/amiss-linux-x86_64","role":"executable"}],"tree_path":"dist/amiss-linux-x86_64"},{"artifact_name":"amiss-macos-aarch64","binary_sha256":"sha256:3c69e0e4f127a7770f3e97c9048e56e8eb5b1337084c4297ed5996f74acd175f","engine_digest":"sha256:f8dc633403606c7a5fa1d29629642f034e3b28dd068afaa1e9901f2e7688ebd0","environment_contract":"scanner-process-env","platform":"macos-aarch64","runtime_contract":"manifest-closed","runtime_files":[{"file_sha256":"sha256:642f9cfea065dc2a5d2651deb1812ff02108fdcb0088ee1d04f501418e85a711","git_mode":"100644","path":"action.yml","role":"runtime-data"},{"file_sha256":"sha256:3c69e0e4f127a7770f3e97c9048e56e8eb5b1337084c4297ed5996f74acd175f","git_mode":"100755","path":"dist/amiss-macos-aarch64","role":"executable"}],"tree_path":"dist/amiss-macos-aarch64"},{"artifact_name":"amiss-macos-x86_64","binary_sha256":"sha256:0ac14b4200af13c60a9a3a8b2383dc83dd51232d29360074e122cc2b9c3923e0","engine_digest":"sha256:a88f1f990f6b04f11acdb6ea44872d8a9727f24a49e18b84f3c75d4860bb708b","environment_contract":"scanner-process-env","platform":"macos-x86_64","runtime_contract":"manifest-closed","runtime_files":[{"file_sha256":"sha256:642f9cfea065dc2a5d2651deb1812ff02108fdcb0088ee1d04f501418e85a711","git_mode":"100644","path":"action.yml","role":"runtime-data"},{"file_sha256":"sha256:0ac14b4200af13c60a9a3a8b2383dc83dd51232d29360074e122cc2b9c3923e0","git_mode":"100755","path":"dist/amiss-macos-x86_64","role":"executable"}],"tree_path":"dist/amiss-macos-x86_64"},{"artifact_name":"amiss-windows-x86_64","binary_sha256":"sha256:f22f2845b65879710d08f0127747bfb0cb68aef37183cb37849cb94c2c8ff406","engine_digest":"sha256:4a0ce15d8b7d7a1185ddca47a642c0b65a94d8250a4283e1f9b519ac7e21c704","environment_contract":"scanner-process-env","platform":"windows-x86_64","runtime_contract":"manifest-closed","runtime_files":[{"file_sha256":"sha256:642f9cfea065dc2a5d2651deb1812ff02108fdcb0088ee1d04f501418e85a711","git_mode":"100644","path":"action.yml","role":"runtime-data"},{"file_sha256":"sha256:f22f2845b65879710d08f0127747bfb0cb68aef37183cb37849cb94c2c8ff406","git_mode":"100755","path":"dist/amiss-windows-x86_64.exe","role":"executable"}],"tree_path":"dist/amiss-windows-x86_64.exe"}],"build_source":{"commit_oid":"60a20b1365c97a5deab9b6b8e874ec6ae929a65a","object_format":"sha1","repository":{"host":"github.com","name":"amiss","owner":"hardmax71"}},"dependency_lock":{"files":[{"path":"Cargo.lock","raw_digest":"sha256:77dc7b09105b31ae99b039e8b1a853cde2ac3a0d543fc8b7d312c6a90d77cdfd"}],"schema":"amiss/scanner-dependency-lock-input"},"dependency_lock_digest":"sha256:aaf16757250e7e84aa5417dbf77789d222ec7d2458b26b0a9949cba6c93ca091","engine_version":"0.32.2","schema":"amiss/scanner-release-manifest"}
